Rank	Name	Platform	Publisher	Developer	Critic_Score	User_Score	Total_Shipped	Year	Genres	Indie	Players	Description	Tags
2533	Dragon's Dogma: Dark Arisen	PC	Capcom	Capcom	8.1	8.1	0.97	2016	Action, Adventure, RPG	0.0	singleplayer, multiplayer	"Dragon's Dogma: Dark Arisen is an action-RPG from a third-person perspective. The story unfolds in a medieval world filled with magic, riddles and mysterious creatures.
A dragon attacks the village in which the main character lives. Trying to protect his home, the character controlled by the player becomes a victim of a beast. The Dragon takes his heart and flies away to the vast unknown. The hero goes after him to discover the mysteries of the dragon and find out why he needs a human heart.
The open world of the game is available immediately after the introduction of the introductory mission. The player is invited to choose a character class and its gender. One of the innovations is the system of partners. As the game progresses, the main character will be joined by comrades-in-arms. Thanks to the size of the game world and its details, the game is often compared with The Elder Scrolls series, and for a dynamic battle system with Devil May Cry."	RPG, Open World, Character Customization, Action, Adventure, Fantasy, Singleplayer, Action RPG, Dragons, Third Person, Dark Fantasy, Magic, Exploration, Great Soundtrack, Atmospheric, Story Rich, Difficult, JRPG, Multiplayer, Hack and Slash
2560	Firewatch	PC	Unknown	Unknown	8.1	6.9	0.96	2016	Adventure, Indie	1.0	singleplayer	Firewatch is a mysterious adventure game with beautiful graphics, which tells a story of a fire lookout Henry. From the very beginning, the game sets up a tough atmosphere of loneliness. The main action takes place in Shoshone National Forest of Wyoming in 1989 (a reference to Yellowstone fires of 1988). According to the storyline, right after the appointment to the fire tower in Shoshone forest Henry starts facing strange things. The further gameplay is based on exploring the entire forest and investigating its phenomena. Players’ progress will affect the accessibility of the distant game areas. Sometimes the silence is being interrupted by the protagonist's walkie-talkie, which connects him with his supervisor Delilah. Gameplay also includes mechanics of choice within the dialogue: each optional phrase reflects on Henry’s relations with Dalilah. In addition to the puzzles of the forest, Henry tries to solve his own experiences while wandering. Playing for Henry and his accomplice gamers will have to clear up the mysteries of the past, connected with the fire tower in Shoshone National Forest.	Adventure, Atmospheric, Story Rich, Walking Simulator, Mystery, First-Person, Singleplayer, Exploration, Open World, Indie, Great Soundtrack, Short, Comedy, Funny, Drama, Colorful, Mature, Thriller, Horror, Casual
2574	Football Manager 2018	PC	Sega	Sports Interactive	8.2	5.7	0.96	2017					
2661	Overwatch	PC	Blizzard Entertainment	Blizzard Entertainment	9.5	6.7	0.92	2016					
2853	Mafia III	PC	2K Games	Hangar 13	6.5	3.6	0.86	2016					
2887	SUPERHOT	PC	SUPERHOT Team	SUPERHOT Team	8.2	7.5	0.84	2016	Action, Indie	1.0	singleplayer, coop	"SUPERHOT is an artistically minimalistic first-person shooter. The key feature of the project is its time mechanics. If you don’t move the action slows down so you can think over your next steps. This feature brings together shooters and strategies, making SUPERHOT a mix of these genres.
The story follows the concept of a ""game inside a game."" It starts with your friend who sends you a game you definitely need to try. But the further you go, the more you realize there's somebody except you in the game, who wants you to stop playing. So you progress through similar levels killing enemies and trying to figure out what's happening. 
Besides original time mechanics, the game makes you quite vulnerable: a single enemy shot kills you making start the level again. At the same time your weaponry is limited, so to survive you need to pick enemies' guns and ammo or use melee combat. Additional to the campaign mode, there's the endless one and the challenge to make levels more difficult."	Action, FPS, Bullet Time, Time Manipulation, Indie, First-Person, Singleplayer, Shooter, Puzzle, Minimalist, Short, Difficult, Cyberpunk, Kickstarter, Violent, Fast-Paced, Sci-fi, Casual, Adventure, Co-op
2908	Dead Cells	PC	Motion Twin	Motion Twin	8.9	7.5	0.83	2017	Action, Indie	1.0	singleplayer	"Dead Cells is a roguelike adventure title developed by Motion Twin.
Story
Not much story is present in the game, as only bits of any information are given out to the players. The game takes place at a remote island, where the players take place of the Prisoner. The Prisoner does not speak, yet he can express confusion and frustration using his body language. The Prisoner is basically immortal, as, in case of death, his head disconnects itself from the Prisoner's body, and gets back to the game's starting area. 
Gameplay
The game's heavily inspired by The Binding of Isaac, as stated by the developers.
Dead Cells features the procedurally generated environments that are typical for roguelike games, yet it puts a strong emphasis on exploration that is typically found in metroidvanias.
The players set out to explore the island where a prison was built. As the players come down into the dungeons of the island, they find various loot, fight dangerous creatures, collect armor, abilities, and power-ups. Upon death, the players lose all the loot they had on them. It is possible to find a shopkeep somewhere in the dungeons to purchase new equipment or have some rest. 
The game uses death as a learning experience, as it randomizes the placement of enemies, so the players can't take multiple attempts to complete a level. The developers want the player to examine the enemy behavior and learn how to combat the enemies themselves."	Roguevania, Souls-like, Roguelike, Pixel Graphics, Metroidvania, Action Roguelike, Action, 2D, Difficult, Roguelite, Hack and Slash, Replay Value, Platformer, Indie, Singleplayer, Procedural Generation, Great Soundtrack, Side Scroller, Perma Death, Adventure
2966	theHunter: Call of the Wild	PC	Maximum Games	Expansive Worlds	6.4	7.4	0.82	2017	Adventure, Simulation, Sports	0.0	singleplayer, multiplayer, coop, online coop	theHunter: Call of the Wild offers the most immersive hunting experience ever created. Step into a beautiful open world teeming with life, from majestic deer and awe-inspiring bison, down to the countless birds, critters and insects of the wilderness. Every inch of the 50-square mile world is crafted using Apex, award-winning technology crafted by Avalanche Studios during a decade of developing explosive action games. In addition to its rich single player experience, theHunter: Call of the Wild offers unique multiplayer options – cooperative and competitive – for up to 8 players. Share the ultimate hunting experience, and earn those bragging rights!KEY FEATURES:A Next-Generation Hunting Experience.theHunter: Call of the Wild offers the most immersive hunting experience ever created. Step into a beautiful open world teeming with life, from majestic deer and awe-inspiring bison down to the countless birds, critters and insects of the wilderness.Experience complex animal behavior, dynamic weather events, full day and night cycles, simulated ballistics, highly realistic acoustics, scents carried by a sophisticated wind system, and much more. All systems work together to increase immersion and bring out the hunter in you.Explore a Vast Open World. By Foot or ATV.Explore 50 square miles of varied terrain, ranging from wetlands and dense forests to lush valleys and open farm fields. The vast world of theHunter: Call of the Wild is split up into separate and distinct hunting reserves, each one filled with surprises and memorable moments.Take on missions and challenges from the locals, or go off the beaten path. Discover lookouts, hunting towers and outposts. Tired of walking between your hunts? Get the ATV Saber 4x4 (optional paid DLC) and drive around! This capable vehicle will carry you across rough terrain at breakneck speeds. Exploring the open world has never been more fun.A Decade in the Making.theHunter: Call of the Wild is the evolution of theHunter, Expansive Worlds’ stand-out hunting game, with over 6 million registered players and 7 years of live operations.Avalanche Studios and Expansive Worlds bring hunting to a new generation of players. theHunter: Call of the Wild is built using Apex – Avalanche Open World Engine, award-winning technology crafted during a decade of developing explosive action games.Become a Hunter. Design the Hunt. Acquire and equip a range of rifles, handguns and bows and customize them with scopes and different ammunition types. Find and master your favorites. Practice and steady your aim at the shooting range. Develop your character by unlocking various skills and equipment. Learn how to use callers and scents, but above all else, study your prey: pay close attention to animal behavior, traits and patterns of movement.New to hunting? Not a problem. Intelligent systems will aid and assist to make sure you get the most out of your hunt, whether you’re a hopeful novice or grizzled veteran.Share Hunting Experiences. Earn Bragging Rights.In addition to its rich single player experience, theHunter: Call of the Wild offers unique multiplayer options. Join up to 8 friends (or complete strangers!) in cooperative and competitive modes. Enjoy a wide range of in-game challenges and events. Hunting is more rewarding and exciting with friends, so share your experiences and earn those bragging rights.Head out with your friends using ATVs. Moving between hunting spots on four wheels is fast, easy and most importantly – a lot of fun. Besides, after a long day of hunting, no one is going to turn down your invitation for an impromptu off-road race!	Hunting, Open World, Multiplayer, Simulation, First-Person, Shooter, Adventure, Realistic, Co-op, Action, Survival, FPS, Singleplayer, Sports, Walking Simulator, Atmospheric, Online Co-Op, Combat, Strategy, Gore
3029	Farming Simulator 17	PC	Focus Home Interactive	Giants Software	6.9	7.6	0.8	2016	Simulation	0.0	singleplayer, multiplayer, coop, online coop	"THE MOST COMPLETE FARMING SIMULATOR EXPERIENCE
Take on the role of a modern farmer in Farming Simulator 17! Immerse yourself in a huge open world loaded with new content: new environment, vehicles, animals, crops and gameplay mechanics!
Explore farming possibilities over hundreds of acres of land, including a detailed new North American environment. Drive over 250 authentic farming vehicles and equipment from over 75 manufacturers, including new brands such as Challenger, Fendt, Valtra or Massey Ferguson.
Harvest many types of crops, including for the first time sunflowers and soy beans. Take care of your livestock - cows, sheep, chickens and now pigs - take part in forestry, and sell your products to expand your farm! Transport your goods with trucks and trailers, or load and drive trains to reach your destination.
Farming Simulator 17 offers rich online activities: play in co-operative multiplayer up to 16 players, and download mods created by the passionate community for unlimited content and an ever-evolving Farming Simulator 17 experience."	Farming Sim, Simulation, Automobile Sim, Multiplayer, Agriculture, Open World, Realistic, Economy, Driving, Moddable, Singleplayer, Management, First-Person, Co-op, Online Co-Op, Family Friendly, Third Person, Sandbox, Strategy, Great Soundtrack
3135	Battlefield 1	PC	Electronic Arts	EA DICE	9.1	7.1	0.77	2016	Action, Massively Multiplayer	0.0	singleplayer, multiplayer, pvp	Battlefield 1 is a first-person action shooter set in the historical period of the World War I. Although the game is a part of the Battlefield franchise, it has no references to the previous chapters. Players are able to experience both single and multiplayer mods to get in action and to feel the era better. As a single-player campaign, Battlefield 1 offers 6 storylines (chapters) one following each other. Each consists of several missions and tells a story of a single man in the middle of a global military conflict. Playing for these soldiers and closing the targets introduces new game mechanics to players. Completing these missions gives an opportunity to dive into the history and to examine the warfare of past ages. Multiplayer experience is divided into 9 different game mods spread on 31 historical maps. You can join the dynamic battle alone or in a squad with your friends. Multiplayer allows you to assume different battlefield roles (classes) starting with a medic, support or assault and following to the tank driver, pilot and some elite units.	FPS, Shooter, Action, Multiplayer, World War I, War, First-Person, Atmospheric, Singleplayer, PvP, Gore, Open World, Historical, Destruction, Massively Multiplayer, Physics, Tanks, Violent, Masterpiece, Mature
3423	Rocksmith 2014	PC	Ubisoft	Ubisoft San Francisco	9.0		0.7	2016					
3474	Half-Life: Alyx	PC	Valve	Valve	9.3	9.1	0.68	2020		0.0	singleplayer	"Half-Life: Alyx is Valve’s VR return to the Half-Life series. It’s the story of an impossible fight against a vicious alien race known as the Combine, set between the events of Half-Life and Half-Life 2.
Playing as Alyx Vance, you are humanity’s only chance for survival. The Combine’s control of the planet since the Black Mesa incident has only strengthened as they corral the remaining population in cities. Among them are some of Earth’s greatest scientists: you and your father, Dr. Eli Vance.
As founders of a fledgling resistance, you’ve continued your clandestine scientific activity—performing critical research, and building invaluable tools for the few humans brave enough to defy the Combine.
Every day, you learn more about your enemy, and every day you work toward finding a weakness.
ABOUT GAMEPLAY IN VR:
Valve’s return to the Half-Life universe that started it all was built from the ground up for virtual reality. VR was built to enable the gameplay that sits at the heart of Half-Life.
Immerse yourself in deep environmental interactions, puzzle solving, world exploration, and visceral combat.
Lean to aim around a broken wall and under a Barnacle to make an impossible shot. Rummage through shelves to find a healing syringe and some shotgun shells. Manipulate tools to hack alien interfaces. Toss a bottle through a window to distract an enemy. Rip a Headcrab off your face and throw it at a Combine soldier.
Extra content for Index owners
Customers who have purchased Valve Index hardware by the end of 2019 will have access to unique bonuses starting early next year:
Explore environments from Half-Life: Alyx in your SteamVR Home space
Alternate gun skins to embellish Alyx's arsenal
Special Half-Life: Alyx-themed content for Counter-Strike: Global Offensive and Dota 2
Community-built environments
A set of Source 2 tools for building new environments will ship with the game, enabling any player to build and contribute new environments for the community to enjoy. Hammer, Valve’s level authoring tool, has been updated with all of the game’s virtual reality gameplay tools and components."	VR, Masterpiece, FPS, Story Rich, Horror, Shooter, Female Protagonist, First-Person, Action, Zombies, Atmospheric, Sci-fi, Psychological Horror, Beautiful, Singleplayer, Adventure, Aliens, Futuristic, Memes, Great Soundtrack
3474	Half-Life: Alyx	PC	Valve	Valve	9.3	9.1	0.68	2020	Action	0.0	singleplayer	"Half-Life: Alyx is Valve’s VR return to the Half-Life series. It’s the story of an impossible fight against a vicious alien race known as the Combine, set between the events of Half-Life and Half-Life 2.
Playing as Alyx Vance, you are humanity’s only chance for survival. The Combine’s control of the planet since the Black Mesa incident has only strengthened as they corral the remaining population in cities. Among them are some of Earth’s greatest scientists: you and your father, Dr. Eli Vance.
As founders of a fledgling resistance, you’ve continued your clandestine scientific activity—performing critical research, and building invaluable tools for the few humans brave enough to defy the Combine.
Every day, you learn more about your enemy, and every day you work toward finding a weakness.
ABOUT GAMEPLAY IN VR:
Valve’s return to the Half-Life universe that started it all was built from the ground up for virtual reality. VR was built to enable the gameplay that sits at the heart of Half-Life.
Immerse yourself in deep environmental interactions, puzzle solving, world exploration, and visceral combat.
Lean to aim around a broken wall and under a Barnacle to make an impossible shot. Rummage through shelves to find a healing syringe and some shotgun shells. Manipulate tools to hack alien interfaces. Toss a bottle through a window to distract an enemy. Rip a Headcrab off your face and throw it at a Combine soldier.
Extra content for Index owners
Customers who have purchased Valve Index hardware by the end of 2019 will have access to unique bonuses starting early next year:
Explore environments from Half-Life: Alyx in your SteamVR Home space
Alternate gun skins to embellish Alyx's arsenal
Special Half-Life: Alyx-themed content for Counter-Strike: Global Offensive and Dota 2
Community-built environments
A set of Source 2 tools for building new environments will ship with the game, enabling any player to build and contribute new environments for the community to enjoy. Hammer, Valve’s level authoring tool, has been updated with all of the game’s virtual reality gameplay tools and components."	Action, 2D, 3D, Singleplayer, Adventure, Documentary, Character Action Game, Masterpiece
3521	Resident Evil VII: Biohazard	PC	Capcom	Capcom	7.9		0.67	2017					
3907	Hyper Light Drifter	PC	Rebellion Games	Rebellion Games	8.4	8.3	0.6	2016	Action, Adventure, Indie, RPG	1.0	singleplayer	"Hyper Light Drifter is a Kickstarter-funded 2D game with a high focus on resource-management and nostalgic vibes. It is the only game of its sort — no Hyper Light Drifter series exists. The title has been initially released for PCs, after half a year it has been ported to the consoles and in 2018 the Switch version сame to life. The developers position their title as a tribute to The Legend of Zelda and Diablo series. Among the sources of inspiration are also Studio Ghibli cartoons.
Hyper Light Drifter follows a story of Drifter, who controls a sword composed of technological achievements not yet known to the world game resembles. The point of the protagonist's adventures is to find a cure to the strange disease no one knows how to heal. 
The central Drifter's weapon is an Energy Sword. The resource-management part comes in handy when the player is up to charge their sword and long-ranged weapons: must they not find an energy supply within the world, but should they hit the enemies to gain power from them."	Pixel Graphics, Great Soundtrack, Atmospheric, Adventure, Difficult, Indie, Action, Singleplayer, Hack and Slash, RPG, Exploration, 2D, Colorful, Post-apocalyptic, Action RPG, Top-Down, Fantasy, Sci-fi, Metroidvania, Souls-like
3986	Farming Simulator 19	PC	Focus Home Interactive	Giants Software	7.3	6.5	0.58	2018	Simulation	0.0	singleplayer, multiplayer, coop, online coop	"The best-selling franchise returns this year with a complete overhaul of the graphics engine, offering the most striking and immersive visuals and effects, along with the deepest and most complete farming experience ever.
Farming Simulator 19 takes the biggest step forward yet with the franchise’s most extensive vehicle roster ever! You’ll take control of vehicles and machines faithfully recreated from all the leading brands in the industry, including for the first time John Deere, the largest agriculture machinery company in the world, Case IH, New Holland, Challenger, Fendt, Massey Ferguson, Valtra, Krone, Deutz-Fahr and many more.
Farming Simulator 19 will feature new American and European environments in which to develop and expand your farm and will introduce many exciting new farming activities, including new machinery and crops with cotton and oat! Tend to your livestock of pigs, cows, sheep, and chickens - or ride your horses for the first time, letting you explore in a brand-new way the vast land around your farm.
Farming Simulator 19 is the richest and most complete farming experience ever made!
MAIN FEATURES
The biggest step forward for the Farming Simulator franchise, offering the most striking and immersive graphics ever
Use and drive hundreds of faithfully reproduced farming vehicles and tools, including for the first time John Deere
Tend to your livestock including pigs, cows, sheep, chicken, and for the first time horses
Ride your own horses and explore the vast areas offered in huge open worlds loaded with farming activities
Develop your farm online with up to 16 players and enrich your Farming experience with community-created mods"	Simulation, Farming Sim, Multiplayer, Agriculture, Realistic, Open World, Driving, Singleplayer, Automobile Sim, Management, Moddable, Co-op, Resource Management, Relaxing, First-Person, Online Co-Op, Economy, Atmospheric, Strategy, Family Friendly
3986	Farming Simulator 19	PC	Focus Home Interactive	Giants Software	7.3	6.5	0.58	2018	Casual	0.0		"The best-selling franchise returns this year with a complete overhaul of the graphics engine, offering the most striking and immersive visuals and effects, along with the deepest and most complete farming experience ever.
Farming Simulator 19 takes the biggest step forward yet with the franchise’s most extensive vehicle roster ever! You’ll take control of vehicles and machines faithfully recreated from all the leading brands in the industry, including for the first time John Deere, the largest agriculture machinery company in the world, Case IH, New Holland, Challenger, Fendt, Massey Ferguson, Valtra, Krone, Deutz-Fahr and many more.
Farming Simulator 19 will feature new American and European environments in which to develop and expand your farm and will introduce many exciting new farming activities, including new machinery and crops with cotton and oat! Tend to your livestock of pigs, cows, sheep, and chickens - or ride your horses for the first time, letting you explore in a brand-new way the vast land around your farm.
Farming Simulator 19 is the richest and most complete farming experience ever made!
MAIN FEATURES
The biggest step forward for the Farming Simulator franchise, offering the most striking and immersive graphics ever
Use and drive hundreds of faithfully reproduced farming vehicles and tools, including for the first time John Deere
Tend to your livestock including pigs, cows, sheep, chicken, and for the first time horses
Ride your own horses and explore the vast areas offered in huge open worlds loaded with farming activities
Develop your farm online with up to 16 players and enrich your Farming experience with community-created mods"	Casual, Time Management
4037	ABZU	PC	505 Games	Giant Squid Studios	8.3	6.9	0.58	2016	Action, Adventure, Casual, Indie, Simulation	1.0	singleplayer	"Abzu is a classic adventure game, the action of which unfolds in the endless ocean. The protagonist is a female diver, wakes up alone drifting on the ocean surface.
The main gameplay is aimed at exploring the surrounding world: the main character finds the ruins and traces of an ancient civilization that existed in symbiosis with the world's ocean. The outside world reacts to the player's actions and changes under his/her influence. However, it will not only be necessary to explore the underwater world: ground fragments also come into play in the game. Despite the simplicity and serenity of the game, there are dangers in the form of sea predators.
The story is told without a single word and the silence only helps to create a unique atmosphere of peace and tranquillity that reigns in the world of the game. The mosaic of the game setting is completed by the implementation of the game camera and the opportunity to look at the world through the eyes of fish - you need to enter the meditation mode for this."	Relaxing, Atmospheric, Underwater, Exploration, Great Soundtrack, Adventure, Singleplayer, Casual, Indie, Colorful, Fantasy, Family Friendly, Short, Story Rich, Open World, Beautiful, Simulation, Third Person, Walking Simulator, Controller
4090	Final Fantasy X / X-2 HD Remaster	PC	Square Enix	Square Enix	8.3	9.0	0.57	2016					
4238	Wolfenstein II: The New Colossus	PC	Bethesda Softworks	MachineGames	8.6	6.7	0.55	2017					
