Rank	Name	Platform	Publisher	Developer	Critic_Score	User_Score	Total_Shipped	Year	Genres	Indie	Players	Description	Tags
8535	Pillars of Eternity II: Deadfire	PC	Versus Evil	Obsidian Entertainment	8.8	7.7	0.2	2018	RPG	0.0	singleplayer	"Pursue a rogue god over land and sea in the sequel to the multi-award-winning RPG Pillars of Eternity. Captain your ship on a dangerous voyage of discovery across the vast unexplored archipelago region of the Deadfire. Bend the world to your will, as you explore the depths of infinite possibilities, including detailed character customization, total freedom of exploration, and more meaningful choices at every turn.
•   Immerse yourself in a deeper single player RPG game experience - enriched with cutting edge technology and features, Deadfire builds on the foundation of classic D&D gameplay with vastly improved graphics, deeper game mechanics and a whole new hand-crafted adventure where choices truly matter.
•   Discover the new region of the Deadfire – plot your own course by ship and explore the rich and exotic islands of the archipelago region, discovering new places interacting with their inhabitants and engaging in a variety of quests at every port.
•   Build your party and customize your companions – choose from 7 different companions to join you on your quest and assign multiple classes and deeper abilities for each. Witness their personal relationships and interactions unfold with the addition of the new companion system.
•   Captain your ship across the seas – as your stronghold on the seas, your ship is much more than simply a vessel for exploring.  Upgrade your ship and crew and choose what skills you improve in order to survive dangerous encounters along the way."	RPG, Party-Based RPG, Isometric, Story Rich, Fantasy, Singleplayer, Character Customization, CRPG, Open World, Choices Matter, Real-Time with Pause, Turn-Based, Adventure, Pirates, Nudity, Exploration, Great Soundtrack, Atmospheric, Romance, Female Protagonist
8667	Titanfall 2	PC	Electronic Arts	Respawn Entertainment	8.6	8.2	0.2	2016	Action	0.0	singleplayer, multiplayer, pvp	"Now Titanfall 2 has a full-scale story campaign. The main plot is the confrontation of the people's Militia against the IMC Corporation, which seeks to destroy the rebels of the Frontier, a region of star systems that will allow them to get control over their resources.
You play as Jack Cooper, a soldier who dreams of becoming an elite pilot with advanced technology and a personal Titan - a fighting machine. Captain Tai Lastimosa trained Cooper and prepared for his candidacy. During the task of finding the missing Major Anderson, who had the information about the plans of the IMC. The entire squad of Cooper, including Lastimosa, dies in the attack of IMC mercenaries. The Captain gives his Titan to Cooper.
As the first part of the game, it is a first-person shooter in which you can control the pilot and exoskeleton ""Titan"". The pilot has a diverse arsenal of abilities that allow you to jump and run on steep walls with the help of the ""jump pilot module"". These abilities can be used with each other to move through the game locations quickly.
With enough points, the player can call the Titan, landing from the sky. They are much slower than pilots but have more powerful weapons."	Masterpiece, FPS, Multiplayer, Action, Shooter, Singleplayer, Sci-fi, Mechs, First-Person, Futuristic, Parkour, PvP, Military, Combat, Time Travel, Team-Based, Hero Shooter, Violent, Gore, RTS
8704	Battleborn	PC	2K Games	Gearbox Software	6.9	7.1	0.2	2016	Action	0.0	singleplayer, multiplayer, pvp, coop, online coop	"Battleborn is a first-person shooter game that features several elements from MOBA and was developed by Gearbox Software.
Setting
Humanity fights over the last star in the universe named Solus. Different species had to unite in order to save Solus from destruction by Varelsi. The best fighters of the world are pronounced Battleborn and are sent to fight.
Gameplay
At the beginning of the game of every game mode featured in the game, the players have to choose one of several characters. Every character features their own abilities, skills, and attacks. A loadout system is also present in the game with players choosing three items to carry into the battle with them. Every item can be bought with an in-game currency named Shards. Such equipment enhances your characters abilities or debuffs your enemies powers. 
The players start at level 1 and gain new experience for leveling up after killing enemies or completing objectives. After leveling up, the player unlocks one perk from the character-specific skill tree. These levels are reset on every new game. There are three main game modes available in the game which put ten players in a match against each other. 
Players also increase their command level after every gain. In Battleborn's meta-game this allows for unlocking new outfits and cosmetics. New gear can be unlocked using loot drops after each match or picked up during one. The game also features loot boxes."	Hero Shooter, FPS, Action, Multiplayer, MOBA, Shooter, Co-op, Free to Play, First-Person, PvP, Comedy, Singleplayer, Class-Based, Sci-fi, Funny, Team-Based, Online Co-Op, Memes, Action RPG, RPG
8704	Battleborn	PC	2K Games	Gearbox Software	6.9	7.1	0.2	2016	Action	0.0	singleplayer, multiplayer, pvp, coop, online coop	"Battleborn is a first-person shooter game that features several elements from MOBA and was developed by Gearbox Software.
Setting
Humanity fights over the last star in the universe named Solus. Different species had to unite in order to save Solus from destruction by Varelsi. The best fighters of the world are pronounced Battleborn and are sent to fight.
Gameplay
At the beginning of the game of every game mode featured in the game, the players have to choose one of several characters. Every character features their own abilities, skills, and attacks. A loadout system is also present in the game with players choosing three items to carry into the battle with them. Every item can be bought with an in-game currency named Shards. Such equipment enhances your characters abilities or debuffs your enemies powers. 
The players start at level 1 and gain new experience for leveling up after killing enemies or completing objectives. After leveling up, the player unlocks one perk from the character-specific skill tree. These levels are reset on every new game. There are three main game modes available in the game which put ten players in a match against each other. 
Players also increase their command level after every gain. In Battleborn's meta-game this allows for unlocking new outfits and cosmetics. New gear can be unlocked using loot drops after each match or picked up during one. The game also features loot boxes."	Hero Shooter, FPS, Action, Multiplayer, MOBA, Shooter, Co-op, Free to Play, First-Person, PvP, Comedy, Singleplayer, Class-Based, Sci-fi, Funny, Team-Based, Online Co-Op, Memes, Action RPG, RPG
8827	FIFA 17	PC	Electronic Arts	EA Canada	8.4	4.1	0.19	2016					
8849	Call of Duty: WWII	PC	Activision	Sledgehammer Games	7.3	3.4	0.19	2017	Action	0.0	singleplayer, multiplayer, coop	"Includes Digital Edition Bonus Content: 1,100 Call of Duty Points*
PRE-ORDER AND GET:
- Multiplayer Upgrade (Weapon Unlock + 2XP)
- Zombies Camo***
- Divisions Pack
Call of Duty® returns to its roots with Call of Duty®: WWII - a breathtaking experience that redefines World War II for a new gaming generation. Land in Normandy on D-Day and battle across Europe through iconic locations in history’s most monumental war. Experience classic Call of Duty combat, the bonds of camaraderie, and the unforgiving nature of war against a global power throwing the world into tyranny.
Call of Duty®: WWII creates the definitive World War II next generation experience across three different game modes: Campaign, Multiplayer, and Co-Operative. Featuring stunning visuals, the Campaign transports players to the European theater as they engage in an all-new Call of Duty® story set in iconic World War II battles. Multiplayer marks a return to original, boots-on-the ground Call of Duty gameplay. Authentic weapons and traditional run-and-gun action immerse you in a vast array of World War II-themed locations. The Co-Operative mode unleashes a new and original story in a standalone game experience full of unexpected, adrenaline-pumping moments."	World War II, FPS, Multiplayer, War, Action, Zombies, Shooter, Singleplayer, First-Person, Co-op, Violent, Gore, Historical, Story Rich, Horror, Massively Multiplayer, Psychological Horror, Female Protagonist, Open World, Heist
8961	A Hat in Time	PC	Gears for Breakfast	Gears for Breakfast	7.9	8.5	0.19	2017	Adventure, Indie	1.0	singleplayer, coop	A Hat in Time is a cute-as-heck 3D platformer featuring a little girl who stitches hats for wicked powers.A little girl and her spaceshipIn A Hat in Time you play as a tiny space-travelling girl with a big tophat. Her adventure is halted when all her fuel, the Time Pieces, is lost and scattered across a nearby planet. Hat Kid must now jump, fight and stitch new hats to make her way into every nook and cranny of this new world in order to restore her fuel and resume her journey. On her way, she'll bump into the menacing Mafia of Cooks, the goofy birds of Dead Bird Studio, the spooky shadows of Subcon Forest, and more!Murder on a train! Parades! Trespassing in a movie studio?Every mission in A Hat in Time is unique! At one moment you'll be solving the Murder on the Owl Express by finding clues and interrogating the locals, the next moment you'll be the band marshal in The Big Parade, or sneaking through the bird-run Dead Bird Studio!Small child, giant worldsJump freely around in 5 massive worlds with new adventures to discover around every corner! Just like any child, Hat Kid loves to climb and explore, no mountain is too big for her sense of adventure. She can do multiple jump moves, as well as climb walls, and swing over gaps!Cute hats, magical yarn and snappy badgesBy finding and collecting rare magical yarn, Hat Kid can stitch new cute hats with a variety of abilities, including a witch hat that allows her to cook explosive concoctions, and a wooden ghost mask that allows her to peek into other dimensions. Hats can become even more powerful, by attaching badges that are found, sold and traded by the locals!Community-funded, community-focusedA Hat in Time was successfully funded on Kickstarter, reaching nearly 10 times its goal! In order to celebrate our community, A Hat in Time is releasing with full modding and Steam Workshop support, an in-game screenshot mode, and more!	Cute, 3D Platformer, Collectathon, Great Soundtrack, Female Protagonist, Adventure, Indie, Platformer, Funny, Exploration, Colorful, Third Person, Singleplayer, Open World, Comedy, Moddable, Co-op, Family Friendly, Kickstarter, Action
9069	Sword Art Online: Fatal Bullet	PC	Namco Bandai Games	Dimps Corporation	6.1	7.4	0.18	2018					
9150	Bomber Crew	PC	Curve Digital	Runner Duck	7.5	7.3	0.18	2017	Simulation, Strategy	1.0	singleplayer, multiplayer	"Prepare your crew for their most dangerous mission yet and go chocks away for a sky-bound expedition in this strategic survival sim, Bomber Crew.
Choose your Crew!
Train and personalise your own Bomber Crew. Procedurally-generated names, skills and back stories means a unique experience for everyone, but be careful, as death is permanent.
Immersive flight simulation!
Carefully manage everything from fuel, ammo, hydraulics and more in your very own physics-based Bomber. Make it yours with a wide array of nose art and liveries, or design your own with the simple to use in-game tool.
Fast paced strategy!
Each mission is a high-risk expedition where danger comes from every angle. Enemy fighters, flak guns, poor weather, low oxygen and an array of other perilous dangers await when the wheels are up.
Be prepared!
Preparation is key for a successful mission. Tag enemy fighters before they reach you, make sure your destination is marked but most importantly, make sure you have the right team for the job. On a WW2 bomber, every role is essential for victory!"	World War II, Simulation, Strategy, Management, Flight, Singleplayer, Indie, War, Difficult, Survival, Action, Casual, Roguelike, 3D, Cartoony, Perma Death, Military, Roguelite, Multiplayer, Action-Adventure
9150	Bomber Crew	PC	Curve Digital	Runner Duck	7.5	7.3	0.18	2017	Casual, Indie	1.0	singleplayer, multiplayer, pvp	"Prepare your crew for their most dangerous mission yet and go chocks away for a sky-bound expedition in this strategic survival sim, Bomber Crew.
Choose your Crew!
Train and personalise your own Bomber Crew. Procedurally-generated names, skills and back stories means a unique experience for everyone, but be careful, as death is permanent.
Immersive flight simulation!
Carefully manage everything from fuel, ammo, hydraulics and more in your very own physics-based Bomber. Make it yours with a wide array of nose art and liveries, or design your own with the simple to use in-game tool.
Fast paced strategy!
Each mission is a high-risk expedition where danger comes from every angle. Enemy fighters, flak guns, poor weather, low oxygen and an array of other perilous dangers await when the wheels are up.
Be prepared!
Preparation is key for a successful mission. Tag enemy fighters before they reach you, make sure your destination is marked but most importantly, make sure you have the right team for the job. On a WW2 bomber, every role is essential for victory!"	Indie, Casual, Arcade, PvP, Character Customization, Modern, Third Person, Retro, Singleplayer, Addictive, Colorful, Multiplayer, Relaxing, Early Access, Controller, 1980s, Minigames, Classic, Pixel Graphics, Fighting
9258	BlazBlue: Chrono Phantasma Extend	PC	H2 Interactive Co., Ltd.	Arc System Works	8.5	7.6	0.18	2016					
9439	Disgaea PC	PC	NIS America	Nippon Ichi Software	7.4	9.5	0.17	2016	RPG	0.0	singleplayer	Download the Darkness, Level Up Evil!Two years after the death of his father, Overlord Krichevskoy, the demon prince Laharl awakens to discover that the Netherworld is in turmoil. With unlikely allies, his devious vassal Etna and the angel trainee Flonne, he must battle his way to supremacy to retake the throne and become the next Overlord. Experience the SRPG classic, now on PC!Key Features:An SRPG from the most prolific SRPG creators in the world, Nippon Ichi SoftwareChoose from over 40 unique character typesEven with a max level of 9999, use Transmigration to start all over again, but your characters will be even stronger per level!Delve into the Item World, a randomly generated dungeon world, to level up your items!With max level characters and leveled-up items, dish out millions of points of damage!Over-the-top battle animationsGeo Panels - A puzzle game within a Strategy RPGLift & Throw - Throw your allies up ledges to reach enemies in hard-to-reach spots, or toss your enemies around instead!A zany story set in the Netherworld, where the notions of good and evil are reversedNew to Disgaea PC (It's not just a port!):Updated UI and texturesKeyboard/Mouse and controller supportIncludes all content from Disgaea: Afternoon of DarknessNew Steam features, such as Achievements, Cloud Saves, Badges, and trading cardsLearn about the long and prestigious history of the Disgaea series @ http://disgaea.us/	Strategy RPG, JRPG, Anime, RPG, Turn-Based, Comedy, Turn-Based Strategy, Tactical RPG, Turn-Based Tactics, Funny, Tactical, Strategy, Singleplayer, Great Soundtrack, Replay Value, Demons, 2D, Pixel Graphics, Story Rich, Cute
9505	Dishonored: Death of the Outsider	PC	Bethesda Softworks	Arkane Studios	8.1	6.9	0.17	2017	Action	0.0	singleplayer	"Dishonored: Death of the Outsider is an expansion of Dishonored 2 and a spin-off of the main Dishonored series.
Plot
The game is set in the alternate universe that goes through its steampunk phase. It takes place in the fictional Empire inspired by the XIX-century England. The plot picks up where Dishonored 2 left it. The game follows the adventures of the previous games' villains: Billie Lurk, the captain of a sailing ship, and Daud, the assassin and the leader of The Whalers gang. They search for Outsider, an extradimensional creature from the world known as the Void who can give people supernatural abilities, and are going to kill him. Their story is intertwined with the larger events in the Empire, such as the reinstallment of the Empress, the faction rivalry and the Void influence on the world. The plot is non-linear and features multiple endings.
Gameplay
The player controls Billie Lurk from the first person view. Like its predecessors, Death of the Outsider emphasizes stealth and surprise attacks. Billie wields a dagger and eventually receives superhuman powers, such as teleportation and disguise. The expansion allows the unusually free use of these abilities. The player doesn't have to unlock them, they become available early at the game, and the energy they require regenerates automatically over time. Besides the main plot, the player can also accept side quests."	Stealth, Action, First-Person, Female Protagonist, Singleplayer, Steampunk, Assassin, Atmospheric, Violent, Story Rich, Magic, Adventure, Choices Matter, Dark, Open World, Immersive Sim, Gore, Parkour, FPS, Fantasy
9615	Vampyr	PC	Focus Home Interactive	DONTNOD Entertainment	7.2	6.9	0.16	2018	Action, RPG	0.0	singleplayer	"London, 1918. You are newly-turned Vampyr Dr. Jonathan Reid. As a doctor, you must find a cure to save the city’s flu-ravaged citizens. As a Vampyr, you are cursed to feed on those you vowed to heal.
Will you embrace the monster within? Survive and fight against Vampyr hunters, undead skals, and other supernatural creatures. Use your unholy powers to manipulate and delve into the lives of those around you, to decide who will be your next victim. Struggle to live with your decisions… your actions will save or doom London.
BE THE VAMPYR – Fight and manipulate with supernatural abilities
FEED TO SURVIVE – Be the savior and the stalker
SHAPE LONDON – A web of interconnected citizens reacts to your decisions"	Vampire, RPG, Action, Choices Matter, Open World, Story Rich, Singleplayer, Atmospheric, Horror, Third Person, Violent, Dark Fantasy, Gore, Sexual Content, Dark, Adventure, Great Soundtrack, Stealth, Nudity, Souls-like
9619	Okami HD	PC	Capcom	Capcom	9.2	7.7	0.16	2017					
9647	The Surge	PC	Focus Home Interactive	DECK13 Interactive	7.2	6.8	0.16	2017	Action, RPG	0.0	singleplayer, multiplayer	A catastrophic event has knocked you out during the first day on the job… you wake up equipped with a heavy-grade exoskeleton, in a destroyed section of the complex. Robots gone haywire, insane augmented co-workers and rogue AI - everything wants you dead.Defy deadly enemies and huge bosses in tight, visceral melee combat. Target and slice specific limbs off your foes, with a next-gen loot system where you loot what you dismember. Equip, upgrade and craft new weapons and armors sliced from enemies, and make yourself stronger through a fresh take on leveling-up.	Souls-like, Action, RPG, Sci-fi, Difficult, Third Person, Singleplayer, Mechs, Violent, Hack and Slash, Open World, Robots, Exploration, Cyberpunk, Gore, Action RPG, Adventure, Futuristic, Horror, Multiplayer
9707	Steins;Gate	PC	Nitro+	Nitro+	8.7	8.8	0.16	2016					
9747	SUPERHOT VR	PC	SUPERHOT Team	SUPERHOT Team	8.5	7.2	0.16	2017		1.0	singleplayer, multiplayer	"Blurring the lines between cautious strategy and unbridled mayhem, SUPERHOT VR is the definitive VR FPS in which time moves only when you move. No regenerating health bars. No conveniently placed ammo drops. It's just you, outnumbered and outgunned, grabbing the weapons of fallen enemies to shoot, slice, and maneuver through a hurricane of slow-motion bullets. 

BODIES ARE DISPOSABLE
MIND IS SOFTWARE
BODIES ARE DISPOSABLE
MIND IS SOFTWARE

Decisive winner of dozens of VR Game of the Year awards,  SUPERHOT VR is a title reimagined and redesigned from the ground up for VR and hand tracking controllers. The fruit of over three years of close cooperation between the critically acclaimed SUPERHOT Team and Oculus, SUPERHOT VR brings the intensely visceral action of SUPERHOT directly into your head and soul. And now also - directly into your Vive.

🏆 DICE Awards Immersive Reality Game of The Year 2017 Winner
🏆 New York Game Awards Best Virtual Reality Game 2017 Winner
🏆 Unity Vision Summit Virtual Reality Game 2017 Winner
🏆 Pixel.Awards Best Virtual Reality Game 2017 Winner
🏆 Digital Dragons Best Virtual Reality Game 2017 Winner
🏆 GDCA Best VR Game 2017 Nominee
🏆 SXSW Trending Game of the Year 2017 Nominee


SUPERHOT VR now also includes the massive SUPERHOT FOREVER update, bringing hours of new replayable challenges, achievements and hardcore endless levels to SUPERHOT VR's time-bending gameplay, including:
- Test your aim where only headshots take out enemies.
- Race against your best scores in bullet-time and real-time.
- Try to complete the game without shooting.
- Get hardcore with faster enemies and less reaction time.

The game will test your limits. It will make you hurt. The good kind of pain. But at the end you will prevail. You will be one with the system."	Action, Indie, VR, Shooter, Bullet Time, FPS, First-Person, Time Manipulation, Singleplayer, Minimalist, Atmospheric, Violent, Difficult, Puzzle, Cyberpunk, Multiplayer
9781	Mother Russia Bleeds	PC	Bandai Visual	Unknown	7.0	6.9	0.16	2016	Action, Indie	1.0	multiplayer, coop	"Mother Russia Bleeds is an independent beat 'em up title developed by Le Cartel Studio.
Plot
The game is set in an alternate version of USSR in the eighties. The government cannot do anything with widespread crime, so it simply ignores that. Four street fighters from a gypsy community unwillingly become the test subjects for a new drug called Necro. After escaping from the laboratory, the main character returns back to their community only to find it in ruins and the whole population becoming drug addicts. The protagonist becomes eager to get revenge on those, who did that. Further into the game, the main character starts taking Necro themselves, which causes horrible hallucinations.
Gameplay
Mother Russia Bleeds is a beat 'em up game which is largely inspired by titles such as Streets of Rage and Double Dragon.
The players advance through a level, that is divided into multiple sections. In progress further, the players have to kill every enemy they encounter in a section. At the end of each level, a boss fight is held.
Apart from hand-to-hand combat, the players can use the world's items, such as pipes, knives, bottles, and pistols. One of the defining features of the game is the health regeneration system, as the players can pump Necro out of their enemies corpses and eject them to themselves. A choice is given - regenerate health or become a berserk that has much more strength and speed.
The game can either be completed solo or in a four-player co-op."	Gore, Beat 'em up, Action, Violent, Indie, Great Soundtrack, Pixel Graphics, Co-op, Local Co-Op, Retro, 2D, Atmospheric, Mature, Multiplayer, Difficult, 4 Player Local, Psychological Horror, Nudity, Sexual Content, Female Protagonist
9804	Yooka-Laylee	PC	Team17 Software	Playtonic Games	7.3	6.5	0.16	2018					
9847	Destiny 2	PC	Activision	Bungie	8.3	3.6	0.16	2017	Action, Adventure, Free to Play	0.0	multiplayer, coop, online coop	"Destiny 2 is an online multiplayer first-person shooter. You take on the role of a Guardian that needs to protect the last city on Earth from alien invaders. The game follows its predecessor, Destiny. The goal of the game is to return the Light that was stolen from the Guardians by the aliens.
Destiny 2 features two main activity types: player versus environment and player versus player. PvE is focused on exploration, story missions interaction with NPCs and side quests. PvP features 4v4 team matches in different modes. The game also allows taking part in group missions, such as three-player strikes and six-player raids.
Destiny 2 has a strong RPG aspect that includes character customization and development. There are three classes in the game - Warlock, Hunter, and Titan; they provide different playstyles depending on their specialization and unique abilities. To develop the character you can gain experience points completing the story and side missions."	Free to Play, Looter Shooter, FPS, Multiplayer, Action, Online Co-Op, Adventure, MMORPG, Shooter, Sci-fi, Loot, Open World, Space, First-Person, Great Soundtrack, Co-op, Lore-Rich, Massively Multiplayer, Masterpiece, Atmospheric
