Rank	Name	Platform	Publisher	Developer	Critic_Score	User_Score	Total_Shipped	Year	Genres	Indie	Players	Description	Tags
5	PLAYERUNKNOWN'S BATTLEGROUNDS	PC	PUBG Corporation	PUBG Corporation	8.6	4.7	36.6	2017					
118	Rust	PC	Facepunch Studios	Facepunch Studios	6.1	6.2	9.02	2018	Action, Adventure, Indie, Massively Multiplayer, RPG	1.0	multiplayer, pvp, coop, online coop	"To survive is the main task in the game Rust. It is necessary to survive in the area, which is now wholly wild but was recently inhabited.
At the beginning of the game, there is only a rock and a torch. The rest will have to be found or stolen.
Bears and wolves roam the terrain, there are diseases and radiation in the game, but the main danger comes from other survivors. The game has only a multiplayer mode. We have to engage in skirmishes and hand-to-hand fighting with them.
Players can not only compete, but also unite. Rare minutes of peace and security worth devoting to construction, equipment and strengthen the shelter, the base.
Sometimes some helicopters shoot everyone on the ground. Fortunately, helicopters can be brought down.
Weapons can be found, collected and improved. Sophisticated and more effective weapons sometimes cannot be assembled independently, you need to use drawings and find rare details, sometimes leaving very far.
Sometimes planes drop from the sky ""parcels"" with various useful staff. The falling parcel is visible from afar, the path to its fall can be long. The package can be noticed by others. A long road can be facilitated by a vehicle. For example, a boat."	Survival, Crafting, Multiplayer, Open World, Open World Survival Craft, Building, Sandbox, PvP, Adventure, First-Person, Action, FPS, Nudity, Co-op, Shooter, Indie, Online Co-Op, Early Access, Post-apocalyptic, Simulation
225	Sid Meier's Civilization VI	PC	2K Games	Firaxis Games	8.8	7.0	5.5	2016					
279	Stardew Valley	PC	Chucklefish	ConcernedApe	9.2	8.7	4.91	2016	Indie, RPG, Simulation	1.0	singleplayer, multiplayer	"The hero (in the beginning you can choose gender, name and appearance) - an office worker who inherited an abandoned farm. The landscape of the farm can also be selected. For example, you can decide whether there will be a river nearby for fishing.
The farm area needs to be cleared, and it will take time.
The hero has many different activities: plant and care for plants, raise livestock, practice crafts, extract ore, and also enter into relationships with residents of the neighbouring town to earn game money. Relationships with characters include communication, performing tasks for money, exchanging, searching for fossils and even military actions and marrying. The character is limited by the reserve of strength and health - both parameters are visible on the screen, and the game automatically puts the hero to rest if the limit of his capabilities is close. The game does not set any ultimate or primary goal, its many possibilities are designed for an unlimited time."	Farming Sim, Life Sim, RPG, Pixel Graphics, Agriculture, Simulation, Relaxing, Multiplayer, Crafting, Sandbox, Indie, Building, Singleplayer, Casual, Open World, Great Soundtrack, 2D, Cute, Dating Sim, Fishing
480	Dying Light	PC	Warner Bros. Interactive Entertainment	Techland	7.5	7.9	3.47	2016					
494	World of Warcraft: Battle for Azeroth	PC	Blizzard Entertainment	Blizzard Entertainment	7.9	3.1	3.4	2018					
514	World of Warcraft: Legion	PC	Blizzard Entertainment	Blizzard Entertainment	8.8	7.3	3.3	2016					
516	Dark Souls III	PC	Namco Bandai Games	From Software	8.9	8.4	3.29	2016	Action	0.0	singleplayer, multiplayer, pvp, coop	"Dark Souls III is the fourth installment in the Dark Souls series, now introducing the players to the world of Lothric, a kingdom which has suffered the fate similar to its counterparts from the previous games, descending from its height to utter darkness. A new tale of dark fantasy offers to create and guide the path of game’s protagonist, the Ashen One, through the dangers of the world before him.
Sharing many gameplay similarities with previous installments of the Souls series, Dark Souls III improves at what it is best. These features are the unforgiving difficulty and unique, overwhelming environments. Let alone the soundtracks, allowing players to travel through the familiar locations and encounter new obstacles alike, resulting in a great test of nerves, while also giving the fruit of resolving the secrets and echoes of the past of Dark Souls series.
The new changes to the systems of multiplayer, crafting and combat will offer new and experienced players to challenge themselves on the field of battle, and to enhance the playthrough with each consecutive New Game +, where the in-game cycle never indeed ends, allowing for a multitude of different playstyles, and showing different events based on player’s actions."	Souls-like, Dark Fantasy, Difficult, RPG, Atmospheric, Lore-Rich, Third Person, Exploration, Story Rich, Co-op, Action RPG, PvP, Action, Adventure, Great Soundtrack, Multiplayer, Open World, Singleplayer, Replay Value, Character Customization
631	Subnautica	PC	Unknown Worlds Entertainment	Unknown Worlds Entertainment	8.7	8.4	2.87	2018		1.0	singleplayer, multiplayer	"Subnautica is a first-person game about survival in the deep sea. You control Ryley Robinson, a space traveler in the 22nd century, who crash-landed his starship on a planet that is covered almost entirely by the ocean. The protagonist needs to eat and drink, although this can be disabled in lower difficulty modes. He can desalinate oceanic water, catch or gather the seafood, and create useful tools and structures. Unlike many survival games, Subnautica has a detailed plot, in which Ryley has to uncover why his ship crashed. By exploring the ocean, finding the remnants of other crashes, and listening to the radio messages, Robinson will learn about the enormous Leviathan, the mysterious Precursors, and the reason why this planet is quarantined.
The game is famous for its spectacular portrayal of the ocean and its wildlife. Robinson is equipped with a scuba diving gear that allows the player to spend most of the game underwater, although oxygen still has to be replenished. The player can dive deep and explore the world full of corals, fish, and other colorful sea creatures, often grotesque or bio-luminescent. The environment is randomly generated to improve replayability."	Open World Survival Craft, Survival, Open World, Exploration, Underwater, Crafting, Base Building, Singleplayer, Adventure, Horror, First-Person, Sci-fi, Sandbox, Aliens, Atmospheric, Early Access, Action, Survival Horror, Indie, Multiplayer
769	Rise of the Tomb Raider	PC	Square Enix	Crystal Dynamics	8.6	7.9	2.49	2016		0.0	singleplayer	"Rise of the Tomb Raider is the eleventh entry in the franchise, being a sequel to its predecessor, Tomb Raider, a reboot of the franchise. This story follows Lara Croft, one year after battling her supernatural experiences in Yamatai. This time she is trying to find the legendary city of Kitezh in Siberia, Russia. The legend behind the city begins in the 12th century and still comes nowadays, that this ancient city grants with a promise of immortality. While Lara tries to solve the mystery of Siberia, she encounters an organisation called Trinity. They want to retrieve this gift to themselves. Following the notes of her father, Lara tries to discover the secrets of the ancient city and stop Trinity in doing so.
Exploring the Soviet motive, even more, the game has the DLC's - Baba Yaga, the Temple of the Witch, which follows Lara in the Soviet mine and confronting the legendary witch of Russian folk-tales, Cold Darkness Awakened, the story about a secret biological weapon and Blood Ties and Lara's Nightmare - a fight for ownership of the Croft estate. 
Besides craftmanship and exploring, the game focuses on a very progressive combat system giving a player a wide variety of strategic options. There is a way to evade your opponents in the bushes; stealth kills with bow and arrows or open combat with firearms like shotguns, pistols and other guns. WIth earning experience, you can give Lara new ways of encountering her enemies by three different specialisations - Hunter, Survivor or Brawler. Each skill tree offers various options of combat, for example using Lara's surroundings and fauna, traps or better aim. With these options, you can choose how to guide Lara Croft in her adventures."	Adventure, Action, Lara Croft, Female Protagonist, Singleplayer, Third Person, Exploration, Action-Adventure, Open World, Story Rich, Survival, Puzzle, Stealth, Atmospheric, Third-Person Shooter, Parkour, Shooter, RPG, Great Soundtrack, Quick-Time Events
911	Darkest Dungeon	PC	Red Hook Studios	Red Hook Studios	8.4	7.8	2.21	2016	Indie, RPG, Strategy	1.0	singleplayer	"Darkest Dungeon is a roguelike RPG developed by Red Hook Studios.
The works of Howard Lovecraft served as the main inspiration for the game which addresses the themes of fear and psychological trauma. 
The story begins when the player learns that they inherited a manor from a distant relative who died excavating the catacombs under the manor and accidentally released a number of monsters.
The player controls a group of adventure seekers that explore the dungeons beneath an old manor. Before every expedition, the player has to choose several heroes from the suggested roster and lead them through procedurally generated dungeons collecting treasures and killing various monsters.
The main objective is to save the lives and mental health of the heroes. Mental health declines every time when the player's comrades suffer damage, walk into traps or fall back from the battlefield. If the hero suffers a breakdown, they start to behave unexpectedly. During the expedition, the characters obtain their own traits - permanent behavior patterns, which can be both negative, such as alcoholism and kleptomania or positive like bravery."	Turn-Based Combat, Dark Fantasy, Dungeon Crawler, RPG, Roguelike, Lovecraftian, Difficult, Turn-Based, Singleplayer, Perma Death, Atmospheric, Strategy, Dark, Indie, 2D, Roguelite, Horror, Fantasy, Gothic, Kickstarter
986	Total War: WARHAMMER	PC	Sega	Creative Assembly	8.6	7.4	2.09	2016	Action, Strategy	0.0	singleplayer, multiplayer, coop	"Total War Warhammer is a combination of two franchises, which brings fantasy violence of Warhammer into the combat mechanics of historical Total War series. The turn-based strategy with real-time tactical battles between clashing armies. The story campaign begins with the newly elected Emperor attempting to reunite the shattered kingdom and bring peace under his control.
On the release date, Total War Warhammer offered four playable factions at launch, including Empire, Greenskins, Dwarves and Vampire Courts, but eventually, Chaos and Bretonnians were added as DLC. In total, there’s 13 DLC, some of which are free. Unlike other Total War titles, Warhammer includes the ability of special faction agents to participate in battles in order to give your army an advantage, a wider variety of animations and flying units such as dragons. Addition of magic with unique spells for each faction, which sets Total War Warhammer as a different title from any other Total War game."	Strategy, Fantasy, RTS, War, Turn-Based Strategy, Games Workshop, Grand Strategy, Multiplayer, Tactical, Action, Dark Fantasy, Singleplayer, Turn-Based, Atmospheric, Co-op, Story Rich, Open World, RPG, Gore, Warhammer 40K
1054	Planet Coaster	PC	Frontier Developments	Frontier Developments	8.4	7.7	2.0	2016	Action, Adventure, Casual, Simulation, Strategy	0.0	singleplayer	Surprise, delight and thrill crowds as you build the theme park of your dreams. Build and design incredible coaster parks with unparalleled attention to detail and manage your park in a truly living world.Piece-by-Piece Construction: Planet Coaster makes a designer out of everyone. Lay paths, build scenery, customize rides and make everything in your park unique with piece-by-piece construction and over a thousand unique building components. Landscape Sculpting: Play with nature and reshape the land beneath your feet. Sculpt the landscape to raise mountains, form lakes, dig caverns and even build islands in the sky, then weave coasters through your park above ground and below.Total Authenticity: Recreate your favorite rides or leave the real world at the door. However you love to play, the most realistic rides and most realistic reactions from your guests make Planet Coaster the most authentic simulation ever.Simulation Evolved: The deepest park simulation in gaming history rewards your skills and makes management fun. Control every aspect of your guests’ experience and watch as Planet Coaster’s world reacts to your choices in an instant.A Living World: Every park guest is an expressive individual who thinks, feels and explores your park with their own interests and desires. Together Planet Coaster’s guests will tell you at a glance just how well your park is run.Park Management: You’re the boss with accessible controls that make management fun. Test your skills in a campaign of creative scenarios, or just build for fun and tweak your parks to surprise, delight and thrill your guests. Communal Creation: Planet Coaster links coaster fanatics and creators around the world with the Steam Workshop community hub. Trade scenery, rollercoasters and even entire parks with other players, and add the world’s wildest creations to your own park.Be Inspired: Discover new content from the world’s best coaster park creators every day. Browse and download content from your favorite creators, or choose from the latest designs selected by the Planet Coaster dev team.Share Your Creativity: Whether it’s a magnificent ice cream shop or the world’s most thrilling coaster, build it, name it and share it with the planet. Join a community of creators and see your designs appear in parks around the world.	Simulation, Building, Management, Family Friendly, Sandbox, Relaxing, Strategy, Great Soundtrack, Realistic, Funny, Atmospheric, Economy, Colorful, Third Person, Singleplayer, City Builder, Casual, First-Person, God Game, 3D
1077	Stellaris	PC	Paradox Interactive	Paradox Interactive	7.8	8.0	1.97	2016	Simulation, Strategy	0.0	singleplayer, multiplayer	Stellaris, an evolution of the grand strategy genre with space exploration at its core.Featuring deep strategic gameplay, a rich and enormously diverse selection of alien races and emergent storytelling, Stellaris has engaging challenging gameplay that rewards interstellar exploration as you traverse, discover, interact and learn more about the multitude of species you will encounter during your travels.Etch your name across the cosmos by forging a galactic empire; colonizing remote planets and integrating alien civilizations. Will you expand through war alone or walk the path of diplomacy to achieve your goals?Main FeaturesDeep & Varied Exploration.Enormous procedural galaxies, containing thousands of planets.Explore Anomalies with your heroic Scientist leaders.Infinitely varied races through customization and procedural generation.Advanced Diplomacy system worthy of a Grand Strategy Game.Ship Designer based on a vast array of technologies.Stunning space visuals.	Space, Exploration, Grand Strategy, Sci-fi, 4X, Simulation, Strategy, Sandbox, Moddable, Real-Time with Pause, Diplomacy, Singleplayer, Multiplayer, Procedural Generation, Management, Futuristic, Military, Great Soundtrack, Atmospheric, Replay Value
1140	The Long Dark	PC	Hinterland Studio Inc.	Hinterland Studio Inc.	7.7	8.2	1.88	2017	Adventure, Indie, Simulation, Strategy	1.0	singleplayer	"The Long Dark is a game about surviving in the unforgiving conditions of frozen North Canadian taiga. The Arctic wilderness may be breathtakingly beautiful, thanks to the game’s artful visual style, but it is also deadly. Low temperatures, hungry animals like wolves and bears, and starvation can easily kill your character. To stay alive, he will need to learn how to light a campfire, find shelter, care about his wounds, hunt for food and protect himself in an unfriendly environment. Many necessary items in the game, including some of the weapons, need to be crafted out of the junk that you can find in the woods and in abandoned buildings.
In the story mode, called Wintermute, you control a pilot, Will Mackenzie, who was hired by his ex-wife Astrid to deliver a mysterious cargo. Eventually, his plane crashed in the woods. Will is injured, and Astrid is missing, presumably lost somewhere in the wilderness. Your goal is to survive and to rescue your companion. Wintermute follows a linear plot and only allows you to explore a limited area. However, it is recommended to start with, since it serves as a sort of tutorial to the open-world sandbox mode. This is the most popular mode, in which you are not confined to the plot and can discover new areas."	Open World Survival Craft, Survival, Open World, Exploration, Atmospheric, First-Person, Singleplayer, Adventure, Crafting, Sandbox, Simulation, Post-apocalyptic, Indie, Walking Simulator, Survival Horror, Strategy, Early Access, Action, Difficult, Horror
1216	Ori and the Blind Forest: Definitive Edition	PC	Nordic Games	Moon Studios	8.8	8.7	1.76	2016	Action	1.0	singleplayer	"NEW IN THE DEFINITIVE EDITION
• Packed with new and additional content: New areas, new secrets, new abilities, more story sequences, multiple difficulty modes, full backtracking support and much more!
• Discover Naru’s past in two brand new environments.
• Master two powerful new abilities – Dash and Light Burst.
• Find new secret areas and explore Nibel faster by teleporting between Spirit Wells.
The forest of Nibel is dying. After a powerful storm sets a series of devastating events in motion, Ori must journey to find courage and confront a dark nemesis to save the forest of Nibel. “Ori and the Blind Forest” tells the tale of a young orphan destined for heroics, through a visually stunning Action-Platformer crafted by Moon Studios. Featuring hand-painted artwork, meticulously animated character performance, a fully orchestrated score and dozens of new features in the Definitive Edition, “Ori and the Blind Forest” explores a deeply emotional story about love and sacrifice, and the hope that exists in us all."	Atmospheric, Great Soundtrack, Platformer, Metroidvania, Adventure, Story Rich, Singleplayer, Cute, Action, Fantasy, Difficult, 2D, Indie, Puzzle, Side Scroller, Open World, Controller, Family Friendly, 2.5D, RPG
1248	Cuphead	PC	Studio MDHR	Studio MDHR	8.8	8.3	1.74	2017	Action, Indie	1.0	singleplayer, multiplayer, coop	"Hand-drawn 2D platformer in the style of 30s cartoons. 2D Dark Souls as the fans refer to the difficulty of this one. It took developers 6 years to create and polish their magnum opus. Cuphead is a classic run and gun adventure that heavily emphasizes on boss battles.
Play as Cuphead or his brother Mugman that signed a deal with the devil and know needs to bring the master souls of its debtors. Players can go through the campaign single-handedly or with a friend using built-in co-op capabilities. 
The backgrounds, characters and other miscellaneous staff were painstakingly created using the methods from the era it mimics; Every character and every scene were hand-drawn to mimic vintage American cartoons. Each note in the orchestral soundtrack was composed with unparalleled attention to detail. Cuphead is an addictive mix of bone-crushing difficulty, fun and audiovisual feast that instantly makes you crave for more."	Difficult, Cartoon, Platformer, Great Soundtrack, Co-op, Hand-drawn, Local Co-Op, 2D, Indie, Retro, Cartoony, Multiplayer, Action, Bullet Hell, Shoot 'Em Up, Side Scroller, Colorful, Singleplayer, Funny, Atmospheric
1458	Hitman	PC	Square Enix	IO Interactive	8.3	7.3	1.53	2016					
1568	Grim Dawn	PC	Crate Entertainment	Crate Entertainment	8.4	8.5	1.46	2016	Action, Adventure, Indie, RPG	1.0	singleplayer, multiplayer, coop	"Grim Dawn is an Action RPG developed by Crate Entertainment.
The game is set in a gritty fictional world, which resembles the Victorian era. In a war-torn world of Cairn, humanity is close to extinction. Cairn became a battleground for two extra-terrestrial forces - the Aetherials and Chthonians. Both of which are eager to completely wipe out humanity for different reasons. The game tells us a story of several humans that try to adapt and survive the harsh times.
Like in most Action RPGs, the main focus of the game is put on battling the enemies and gathering loot - armor, potions, weapons, and gold. Grim Dawn features a crafting system that is similar to the one in a popular mod DoTA. The developers put a strong emphasis on the enhanced physics in the game, environmental kills, enemies dismemberment and a totally new mission system. 
The players are free to choose one of eight classes present in the game. Several factions are also featured. As the plot progresses, the player will have to choose which factions to join. Joining one faction will make the opposing one hostile to the protagonist."	Action RPG, Dark Fantasy, Hack and Slash, RPG, Loot, Dungeon Crawler, Dark, Co-op, Multiplayer, Singleplayer, Fantasy, Action, Adventure, Atmospheric, Isometric, Post-apocalyptic, Indie, Zombies, Kickstarter, Crowdfunded
1653	Frostpunk	PC	11 bit studios	11 bit studios	8.4	8.4	1.4	2018	Simulation, Strategy	0.0	singleplayer	"In an ultimately frozen world, people develop steam-powered technology to oppose the overwhelming cold. The city ruler has to manage both the inhabitants and the infrastracture the citizens live in. Leader’s tactical skills face challenges, frequently questioning morality and the basic foundation of what we consider an organized society. Here optimization and resource management often clash with empathy and thoughtful decision-making. While city and society management consume most of the ruler’s time, at some point exploration of outside world is necessary to understand its history and present state.
What decisions will you make so the society can survive? What will you do when pushed to the limits? And...
...who will you become in the process?
THE CITY MUST SURVIVE
Frostpunk is a city-survival game where heat means life and every decision comes with a cost.
MAINTAIN THE HOPE
Survival is about hope and will to live. Your ability to spark and maintain these two in your people will be a determinant factor for success.
MAKE THE LAW
Society is a group of people abiding the same rules and sharing similar beliefs. Establishing laws and customs will be a crucial factor shaping your society.
WEIGHT YOUR CHOICES
Will you allow child-labour? How will you treat the sick and wounded? Frostpunk challenges a player’s tactical skills, while questioning one’s morality.
EXPLORE
The world covers not only bits of the past but also the potential means to secure the future of your people.
""(...) this is a game about finding reasons to survive rather than just the means to go on living.""
- Adam Smith, Rock, Paper, Shotgun
""In a steampunk ice age, the only thing that can be crueler than the bitter cold are the decisions you have to make to keep your people alive.""
- Stephanie Chan, VentureBeat
""(...) decisions push your morality to its limits for the sake of productivity, which could make for an captivating, draining adventure when the game releases later this year.""
- Suriel Vazquez, Game Informer"	Survival, City Builder, Steampunk, Strategy, Resource Management, Post-apocalyptic, Colony Sim, Building, Simulation, Singleplayer, Base Building, Management, Choices Matter, Atmospheric, Economy, Dark, RTS, Difficult, Real-Time with Pause, Great Soundtrack
1661	No Man's Sky	PC	Hello Games	Hello Games	6.1	2.9	1.4	2016		1.0	singleplayer, multiplayer	"No Man's Sky is a space action-adventure survival game developed by Hello Games.
The overall visual style of the game is inspired by various science fiction books. Demoscene also served as a source of inspiration for the developers.
The main feature that the game revolves around is the procedural generation. Each planet you visit is generated from scratch. The information about the planets and their inhabitants is dynamically updated so every player can discover a new species or planet and give it a name.
No Man's Sky gameplay implies the exploration of space and planets some of which are inhabited with extra-terrestrial life, gathering resources, space battles, maintaining and upgrading the player's ship and completing bounty hunting missions. The main objective is to reach the center of the galaxy. 
On release, it was stated that the game is in fact multiplayer, but the size of its world is so big that the probability of meeting another player is extremely small. It turned out that it is impossible to meet any other player due to the extremely limited multiplayer aspect. As of 2018, Hello Games released the fourth major update which included the full multiplayer experience."	Open World, Open World Survival Craft, Space, Exploration, Sci-fi, Survival, Procedural Generation, First-Person, Adventure, Singleplayer, Sandbox, Atmospheric, Crafting, Space Sim, Indie, Multiplayer, Action, Simulation, FPS, Great Soundtrack
