Rank	Name	Platform	Publisher	Developer	Critic_Score	User_Score	Total_Shipped	Year	Genres	Indie	Players	Description	Tags
11828	Football Manager 2019	PC	Sega	Sports Interactive	8.6	6.5	0.11	2018	Simulation	0.0	singleplayer	"Then, when Match Day arrives, you take your place on the touchline, overseeing proceedings as your players cross that magical white line. Now, your footballing vision is put to the test!
Will the perfect substitution or tactical tweak be the difference between an agonising defeat or an ecstatic victory?
Test your skills in 50 of the biggest footballing countries
Climb to the top of the table and beyond with any one of world’s top 2500 clubs
Play the transfer market and scout more than 500,000 real players and staff
Watch your unique football vision play-out on our acclaimed 3D engine
The Bundesliga and Bundesliga 2 are fully licensed and playable for season 2018/19 and give a very early flavour of what’s to come as we build towards kick-off on November 2nd.
In total, there are 26 fully-licensed league competitions from 11 countries as well as a host of individual club licences from some of the world’s biggest leagues, with more still to be confirmed.
Licensing updates along with new features and game upgrades will drop towards the end of September on our social channels, so get following now to get ahead of the game.
Football Manager 2019 is available to pre-purchase now and managers who do so prior to full release on November 2nd will net a cool 10% off.
Advanced pre-purchase will also permit early access to a fully-playable Beta version of the game which should be available at least two weeks prior to the official release date. Single player careers started in this Beta version will also continue into the full game.All purchases of Football Manager 2019 also include a free copy of Football Manager 2019 Touch for PC/Mac only."	Collectathon, Casual, Management, Capitalism, Game Development, Card Game, 2D, Funny, Parody, Choices Matter, Story Rich, Simulation, Hand-drawn, Abstract, Cartoony, Minimalist, Comedy, Memes, Satire, Singleplayer
11882	Mighty No. 9	PC	Deep Silver	Comcept	5.2	3.6	0.11	2016	Action	1.0	singleplayer, multiplayer, coop	"Mighty No. 9 is a sci-fi game that strongly resembles the classic Mega Man series.
Plot
The main protagonist is Beck, a battle android from the Mighty Numbers series (his number is 9). A virus attack led to a machine uprising, and Mighty No. 9 is among the few robots that were not infected. His creator, Dr. White, sends him to stop his rampaging kin and find out who is behind the attack. The Xel technology allows Beck to bring his fellow Numbers back to reason. He will also assimilate their data to send it back to the lab so that Dr. White could find the cure for the virus. Beck is occasionally assisted by Call, a female robot unaffected by the virus.
Gameplay
The player controls Beck in a 2D environment. Like in Mega Man, the protagonist jumps platforms and fires a gun. Beck can also use the special acceleration ability that allows him to leap long distances and through his enemies. By leaping through injured opponents, Beck can assimilate their Xel to receive a temporary power-up. The type of a power-up depends on the color of a Xel: red gives Beck more powerful attacks, green speeds him up, yellow improves his stamina, and blue heals him. Gathering Xel from Mighty Numbers, Beck receives new special abilities.
Multiplayer
The game includes a cooperative multiplayer for two, in which the second player controls Call. Her gameplay is very different and is largely defensive as she uses deflector shields to protect herself and Beck."	Action, Platformer, Anime, Side Scroller, Kickstarter, 2.5D, Retro, Robots, Multiplayer, Singleplayer, Indie, Co-op, Casual, Difficult, Sci-fi, Comedy, 2D, Great Soundtrack, Family Friendly, Female Protagonist
11888	Dungeon Souls	PC	Black Shell Media	Lamina Studios	6.7	5.5	0.11	2016	Action, Adventure, Indie, RPG	1.0	singleplayer, multiplayer	Dungeon Souls is an action-adventure roguelike dungeon crawler.Each level is completely procedurally generated so every playthrough is guaranteed to have unique environments and encounters. Search for and activate all the marks placed in each level to unlock the dungeon portal and escape from the Redeemer. Scavenge various items and upgrades to counter the dungeon's dark forces and challenging bosses. You must survive. Hurry.Dungeon Souls was inspired by Nuclear Throne, Risk of Rain, Overture, BitVenture and Shoot First. Harness the powerful abilities of 10 unique characters Explore a plethora of different environments including dark dungeons, sewers and cathedrals Immerse yourself with deep character progression and permanent skill upgrades Experiment with 50+ unique passive items - Speed boosts, damage buffs, lifesteal bonuses... Battle hordes of dynamic enemies and challenging bosses hell-bent on destroying you	Action Roguelike, RPG, Pixel Graphics, Dungeon Crawler, Indie, Action, Roguelike, Roguelite, Adventure, Hack and Slash, 2D, Procedural Generation, Singleplayer, Bullet Hell, Perma Death, Early Access, Top-Down, Loot, Multiplayer, Local Co-Op
12015	Monster Prom	PC	Those Awesome Guys	Beautiful Glitch	7.3	6.7	0.1	2018	Indie, Simulation	1.0	multiplayer, online coop	"Content Caution
Although it hasn’t been rated yet, Monster Prom features mature themes, naughty words and some objectively bawdy scenarios, not suited for the sheepish or the faint of heart. Please bear this in mind before playing.
--
There’s only 3 weeks left before prom and you haven’t got a date yet..and you’re a monster. But that’s okay ‘cause at your high-school everyone else is too! These are the stepping stones into the world of Monster Prom, a one-to-four player competitive dating sim that has you thinking: I never knew I was into that!
Choose your own adventure and get all the way to your special monster’s heart before anyone else does, take personality quizzes to determine your stats, get into all kinds of funny and absurd situations to seduce your sweetheart and find out more about yourself than you or your friends ever knew.
Play to your strengths to earn better rewards, discover and unlock items that boost your chances at your favourite fiend’s fondness and fight the good fight all in the name of the thing high-schoolers dream of: not going to the prom alone.
Grab up to three friends or play by yourself, enjoy the beautiful art, the witty dialogue and be prepared to make hard choices because at the end of the cruel, cut-throat world of Monster Prom there are only two types of people: lovers and losers. Being a monster is hard, but getting a date for prom is even harder!
Competitive dating sim
Nothing makes the heart grow fonder than a little competition. Set your gaze on one of the sweethearts, but if you share your romantic tastes with your friends, be ready for some stiff competition.
Fantastically funny writing
All's fair in love and war, except maybe taking yourself too seriously. Through whimsical, postmodern humor, written by Cory O’Brien, Maggie Herskowitz and Julián Quijano, there is no topic Monster Prom won’t make fun of, including itself.
Gorgeous art
There’s never a dull moment while exploring the beautifully crafted world and characters drawn by Arthur Tien.
1000+ funny and absurd situations and hundreds of events
Get into the groove of the local monster high-school through hundreds of events that will branch into 1000+ possible situations, all with multiple outcomes.
Couch Multiplayer for one-to-four people
Play by yourself, with a significant other or with your favourite group of friends.
Easy to pick up and play
No learning required, just have your heart strings ready for tugging.
Characters easy to fall in love with
With 6 fully fledged lovable classmates at your fingertips, go ahead and meet, pick and find out just what makes them tick.
Monstrously post-modern slice of life
A beautifully developed universe with a diverse cast of characters, all with their own personal fashion, outfits, style and quirks, set in the modern world of love with all the trimmings: selfies, dating apps, d**kpics, raves, emojis and more.
Freedom of choice
Monsters don’t like boys or girls, they like monsters. In Monster Prom the game experience is unaffected by gender or sexual orientation, since finding love is already hard enough."	Dating Sim, Comedy, Multiplayer, Indie, Choices Matter, Visual Novel, Funny, Simulation, LGBTQ+, Local Multiplayer, Sexual Content, Online Co-Op, Fantasy, Story Rich, Demons, Zombies, Vampire, Great Soundtrack, Nudity, Life Sim
12081	Devil Daggers	PC	Sorath	Sorath	8.3	7.1	0.1	2016	Action, Indie	1.0	singleplayer	"Devil Daggers is a shooter developed by Sorath. This is the only game in the franchise. 
Plot
The player aims to survive through attacks by armies of demonic monsters for as long as possible. To survive, the player must defeat enemies or avoid contact with them; as the game goes, the monsters become more. The action is taken on a field shrouded in darkness. As a weapon, the protagonist can fire daggers from fingers. 
Gameplay
Devil Daggers is a first-person shooter. As the game starts, the player fetches fire daggers.
Then he is transported to the dark arena, where monsters begin to spawn. The goal is to fight off every appearing enemy. More exotic creatures appear throughout the game; later on, the player can recognize the type of a monster based on the unique noise one makes. There are two alternatives in using the daggers: the protagonist can either fire a shotgun-like blast with a widespread (the player clicks the left mouse button) or fire a continuous stream of them (the player holds the mouse button). The player can die if he touches an enemy, or if he falls off the stage. After that the player can fetch the red crystals dropping from the top of the screen – it lets them upgrade the daggers. 
Key features
The game design uses distorted effects like texture warping and polygon jitter. That makes it look like an old shooter game from the 1990s."	FPS, Difficult, Indie, Action, Fast-Paced, Horror, Shooter, Bullet Hell, Singleplayer, Retro, First-Person, Arena Shooter, Atmospheric, Pixel Graphics, Demons, Survival, Arcade, Lovecraftian, Gore, Dark
12117	Homeworld: Deserts of Kharak	PC	Gearbox Publishing	Blackbird Interactive	7.9	7.9	0.1	2016	Strategy	0.0	singleplayer, multiplayer, coop	"HOMEWORLD: DESERTS OF KHARAK
A ground-based RTS prequel to the classic Homeworld games. Assemble your fleet and lead them to victory on the shifting sands of Kharak in this compelling strategy game. Crafted by Blackbird Interactive, a studio founded by veterans of Homeworld and Company of Heroes, Homeworld: Deserts of Kharak takes players to the deserts of Kharak where danger lurks over every dune.
EXPERIENCE AN ORIGIN STORY
In Deserts of Kharak’s campaign, an anomaly is discovered deep in the southern desert. An expedition is sent, but the story is not that simple. Discover the story of Rachel S'jet as she leads her people on a quest to find their destiny in an exciting campaign.
HEAVY DUTY HARDWARE
Take control of fleets of land and air vehicles – from nimble light attack vehicles to massive heavyweight cruisers – built to conquer the desert.
MASSIVE ENVIRONMENTS
Fight your way across massive dune seas, deep craters, and hostile canyons in sprawling maps – all in unprecedented fidelity and scale.
TACTICAL COMBAT
Position your fleet to take advantage of the high ground or create ambushes across dune lines in terrestrial combat. Attack your enemies’ resource operations, or assault their military head-on.
STRATEGIC DECISIONS
Meaningful choices in resource management, fleet composition, and technology research directly impact your chances of survival.
ONLINE MULTIPLAYER
Compete online solo or with friends in a variety of game modes, including ranked play, to rise through the ranks and become the most powerful Fleet Captain on Kharak.
Before you can find your Homeworld, you must first unlock the secrets of the desert."	Strategy, RTS, Sci-fi, Multiplayer, Story Rich, Great Soundtrack, Space, Female Protagonist, Atmospheric, Singleplayer, Action, Futuristic, Real-Time, Co-op, Adventure, Tactical, First-Person
12221	The Technomancer	PC	Focus Home Interactive	Spiders	5.6	6.6	0.1	2016	Action, RPG	0.0	singleplayer	"The Technomancer is a sci-fi RPG set on Mars, featuring dynamic combat and an epic story line, where your choices will affect the fate of the Red Planet. You are a Technomancer, a formidable warrior harnessing destructive electrical powers. Embark on a perilous journey across a planet torn apart by conflict and infested with mutant creatures.
Travel with your companions, choosing between diplomacy, combat or trickery to resolve quests. Gain experience to level up your character, and learn new skills or upgrade perks across 4 unique skill trees. Loot, buy and craft more powerful equipment and weaponry for yourself and teammates, to stand a chance of surviving!
Only you can forge the destiny of Mars.
An adventure set on the terraformed deserts of a post-apocalyptic Red Planet
Three combat styles with deep character customization
Unleash powerful Technomancy abilities on your foes
In-depth crafting changes the appearance and stats of weapons and armour
A world that reacts to your decisions
Relationships with your companions open new pathways and quests"	RPG, Action, Sci-fi, Open World, Third Person, Singleplayer, Cyberpunk, Adventure, Post-apocalyptic, Mars, Nudity, Mature, Great Soundtrack, Atmospheric, Sexual Content, Choices Matter, Story Rich, Action RPG, Character Customization, Romance
12416	Battlefield V	PC	Electronic Arts	EA DICE	8.1	2.8	0.1	2018	Action	0.0	singleplayer, multiplayer, pvp	"Battlefield V is the sixteenth game in its franchise. 
Plot
Like the original Battlefield, the game is based on the real events of World War II. The game focuses on the obscure battles of the war. It features storylines that tie the battles together and consist of episodes called “war stories”.
Gameplay
Battlefield V puts a strong emphasis on realism. The game avoids video game abstractions in favor of immersive experience of the war. For that goal, the game aims to increase the player's interaction with the environment, such as doors, vehicles, or ammo. The ammo and other resources in the game are scarce, forcing the player to use a tactical approach.
The game gives a spotlight to women in the military who are among the main characters in the campaign. The player might also choose to play a female character in the multiplayer, as the gender is not tied to a class. The game also allows the players many customization options for costumes, vehicles, and weapons.
Modes
Battlefield V has many multiplayer modes, some of which are new to the series and some are reimagined versions of the modes from previous games. For example, The Grand Operations mode is based on the original Battlefield mode called Operations. This mode imitates a military campaign and consists of a series of battles with different objectives and non-linear progress options."	FPS, Shooter, World War II, Open World, Atmospheric, Destruction, Combat, PvP, First-Person, Historical, Action, Military, War, Battle Royale, Multiplayer, Massively Multiplayer, Singleplayer, Violent, Female Protagonist, LGBTQ+
12609	American Truck Simulator	PC	SCS Software	SCS Software	7.6	6.8	0.09	2016	Indie, Simulation	1.0	singleplayer, multiplayer	Game mechanics are based on the highly successful model from Euro Truck Simulator 2 and have been expanded with new features, creating the most captivating game experience from SCS Software.American Truck Simulator puts you in the seat of a driver for hire entering the local freight market, making you work your way up to become an owner-operator, and go on to create one of the largest transportation companies in the United States.Features Drive highly detailed truck models officially licensed from iconic truck manufacturers. Your truck is your new home. Make it yours by changing cabins, chassis, paintjobs, adding tuning accessories or more powerful engines. Lots of different cargoes to choose: From food to machinery to hazard cargoes. Multiple types of trailers – from reefers to flatbeds, from dumpers to lowboys and goosenecks. The longest trailers (up to 53 ft) will challenge your skills and patience while hauling and during parking. Deliver your cargoes to a rich variety of companies and locations like refineries, oil storage, gas stations, car factories, or roadworks. Various simulation settings for trucking enthusiasts: Air brake simulation; different types of brakes: retarder, Jake brake, trailer brake; multiple types of transmissions straight from real trucks, brake intensity, and more. Feel like inside a real cabin: Adjust your seat, mirrors and position your head to get the best view of the road. Drive safely, follow the rules and speed limits – police will fine you if you aren't careful! Ensure that you are not delivering overweight cargo – you may be checked at the weigh scales. Use the route adviser as your personal assistant during the travels. Try the life of a truck driver for hire. By delivering the cargoes safely and improving your skills, become the owner of your own, successful company! Build your own fleet of trucks, buy garages, hire drivers, manage your company for maximum profits. Make your trucking time better by listening to your favorite songs via built-in music player or streaming your favorite radio stations. Capture your favorite moments with a photo mode offering rich set of editing options. Great support for steering wheels, gamepads and other input devices. Long-time support of the game, including new features. Obtain challenging Steam achievements and collect all hand-painted Steam trading cards.World of TrucksTake advantage of additional features of American Truck Simulator by joining our online community on World of Trucks, our center for virtual truckers all around the world interested in Euro Truck Simulator 2, American Truck Simulator and future SCS Software's truck simulators. Use in-game Photo Mode to capture the best moments and share them with thousands of people who love trucks.Favorite the images you like the most and return to them anytime in the future.Discuss the screenshots with everyone using World of Trucks.See the best images hand-picked by the game creators in Editor's Pick updated almost every day. Try to get your own screenshot on this list!Upload and use your custom avatar and license plate in the game.More features coming soon!To join World of Trucks, simply sign up with your Steam account on the join page. You will need to own American Truck Simulator or Euro Truck Simulator 2 to join World of Trucks.World of Trucks is an optional service, registration on World of Trucks isn't required to play the game.	Automobile Sim, Simulation, Driving, Open World, America, Realistic, Multiplayer, Singleplayer, Relaxing, Moddable, First-Person, Exploration, Economy, Atmospheric, Adventure, Casual, Indie, Family Friendly, Management, Third Person
12898	FIFA 18	PC	EA Sports	EA Vancouver	8.0	2.6	0.08	2017					
13060	Mirror's Edge Catalyst	PC	Electronic Arts	EA DICE	7.4	5.2	0.08	2016	Action, Adventure	0.0	singleplayer, multiplayer	"Mirror's Edge Catalyst is the second part in the Mirror's Edge series. Like its predecessor, it is based around parkour simulation.
Plot
The game is set in the near future that is depicted as a cyberpunk dystopia. The story takes place in the city of Glass that is ruled by mega-corporations. Faith, the protagonist of the original game, returns in Catalyst. She is a Runner, a person who specializes in illegal delivery. Early in the game, Faith steals a valuable hard drive from a corporation. After reading its data, she learns about the Reflection project that will allow the corporations to control every resident in Glass.
Gameplay
The game combines platforming, parkour, and puzzles in the vein of Portal series. The player controls Faith from the first person view as she runs and leaps across the rooftops of Glass. Puzzle-like level design requires her to use pipes, wires, and ledges to get to her destination. Precision timing is important to perform jumps, slides, and rushes in a seamless flow.
The combat system in Catalyst changed dramatically. Unlike in the original game, Faith cannot use guns. She can fight in hand-to-hand combat but usually has to avoid enemies.
Style
Like its predecessor, Catalyst is notable for its minimalist use of colors. Glass is mostly shining white and dark blue, while the occasional use of other colors signifies something important. The game is accompanied by the cold, atmospheric electronic soundtrack by Solar Fields."	Parkour, 3D Platformer, Female Protagonist, Puzzle Platformer, Runner, Platformer, Action-Adventure, Open World, First-Person, Cyberpunk, Action, Sci-fi, Stylized, Dystopian, Atmospheric, Adventure, Combat, Multiplayer, Singleplayer, Martial Arts
13263	Homefront: The Revolution	PC	Deep Silver	Dambuster Studios	5.4	3.8	0.08	2016	Action, Adventure	0.0	singleplayer, multiplayer, coop, online coop	"Homefront: The Revolution is an open-world FPS developed by Dambuster Studios. It is the second game in the series.
Plot
In 1972, a technological marvel emerged in North Korea. The APEX corporation was found. Sometime later, the North Korean technologies become more widespread than the US. In 2004 the United States began to buy its weaponry from Korea. By 2016 the United States economy is at an all-time low, the US invade the Middle East. In 2025, the US debt to North Korea grows too immense to be paid out, and the economy crumbles. While being helpful at first, North Korea's military set foot on the American soil. You become a part of the resistance based in Philadelphia in 2029 trying to set the city free from Korean People's Army.
Gameplay
The players have to use the insurgency strategies in order to free the city of Philadelphia from the KPA. A wide set of explosives, jammers, and traps is available to the player. It is possible to modify the weapons the player has on the go. Attach suppressors, scopes or convert your weapon entirely as you see fit. 
Philadelphia is split into three zones: the Green Zone where the KPA and their collaborators live in comfort with stable electricity supply and clean drinking water; the Yellow Zone which serves as a ghetto for most of the Philadelphia residents; the Red Zone which mostly consists of bombed-out suburbs of Philly. 
A four-player co-op mode is present in the game and is separated from the main campaign."	Action, FPS, Open World, Multiplayer, Shooter, Co-op, War, First-Person, Online Co-Op, Singleplayer, Stealth, Adventure, Military, Survival, Atmospheric, Dystopian, Crafting, Story Rich, Futuristic, Violent
13467	Far Cry 5	PC	Ubisoft	Ubisoft	6.3	6.0	0.07	2018	Action, Adventure	0.0	singleplayer, multiplayer, coop	"Far Cry 5 is an open-world adventure first-person shooter developed by Ubisoft Montreal. It is the fifth main installment in the series.
Welcome to Hope County, Montana, where a violent religious doomsday cult appeared. You play as a junior deputy sheriff who gets trapped in the Hope County as all the ways out the county are now patrolled with cultists and all external communication is cut off. It is your job to free the county of cultists.
For the first time in the series, the game features a character creation screen. A wide range of weaponry which varies from pistols to grenade launchers is available to the player. Various vehicles are also at your exposal: cars, planes, helicopters, and so on. 
The game puts a strong emphasis on building the resistance to the cultists. Players have to recruit the locals in order to have more fighters and gain reputation.
A welcome addition to the game is the so-called Guns For Hire system. It allows the players to choose one of the comrades that will follow them anywhere. For example, hiring a sniper will help the player spot enemy targets in the distance.
The whole game can be played in both singleplayer and co-op modes."	Open World, Action, FPS, Co-op, Multiplayer, Adventure, Shooter, First-Person, Singleplayer, Survival, Story Rich, America, Stealth, Hunting, Exploration, Atmospheric, Character Customization, Great Soundtrack, Sexual Content, Nudity
